ID	Title	Authors	Journal	Year	Pages	Volume	PMID
1	A sensitive and stereospecific enzymatic assay for xylulose. J. Biol	Hickman, J.,Ashwell, G.	Chem.	1959	758-761	234	13654257
2	Erythritol dehydrogenase from Aerobacter aerogenes. Biochim. Biophys	Jakoby, W.B.,Fredericks, J.	Acta	1961	26-32	48	13789254
3	A new pathway of pentose metabolism. Biochem. Biophys. Res	Chiang, C.,Knight, S.G.	Commun.	1960	554-559	3	13692998
4	Purification and properties of xylitol dehydrogenase from the xylose-fermenting yeast Candida shehatae. Appl. Biochem	Yang, V.W.,Jeffries, T.W.	Biotechnol.	1990	197-206	26	-----
5	Affinity purifications of aldose reductase and xylitol dehydrogenase from the xylose-fermenting yeast Pachysolen tannophilus. Appl. Environ	Bolen, P.L.,Roth, K.A.,Freer, S.N.	Microbiol.	1986	660-664	52	16347161
6	Chirality of xylitol-oxidizing enzymes from mammalian liver	Alizade, M.A.,Brendel, K.,Gaede, K.	FEBS Lett.	1976	41-44	67	8339
7	Inducible xylitol dehydrogenases in enteric bacteria. J	Doten, R.C.,Mortlock, R.P.	Bacteriol.	1985	845-848	162	3886639
8	Purification and properties of D-xylulose reductase from Pachysolen tannophilus. J. Ferment	Morimoto, S.,Matsuo, M.,Azuma, K.,Sinskey, A.J.	Technol.	1986	219-225	64	-----
9	Dual relationships of xylitol and alcohol dehydrogenases in families of two protein types	Persson, B.,Hallborn, J.,Walfridsson, M.,Hahn-Haegerdal, B.,Keraenen, S.,Penttilae, M.,Joernvall, H.	FEBS Lett.	1993	9-14	324	8504864
10	Effect of D-glucose on induction of xylose reductase and xylitol dehydrogenase in Candida tropicalis in the presence of NaCl. J	Ikeuchi, T.,Kiritani, R.,Azuma, M.,Ooshima, H.	Basic Microbiol.	2000	167-175	40	10957958
11	Induction of aldose reductase and xylitol dehydrogenase activities in Candida tenuis CBS 4435. FEMS Microbiol	Kern, M.,Haltrich, D.,Nidetzky, B.,Kulbe, K.D.	Lett.	1997	31-37	149	9103975
12	Induction and regulation of D-xylose catabolizing enzymes in Fusarium oxysporum. Biochem	Singh, A.,Schuegerl, K.	Int.	1992	481-488	28	1482390
13	Development of a xylitol biosensor composed of xylitol dehydrogenase and diaphorase. Can. J	Takamizawa, K.,Uchida, S.,Hatsu, M.,Suzuki, T.,Kawai, K.	Microbiol.	2000	350-357	46	10779871
14	Effect of nitrogen sources on oxidoreductive enzymes and ethanol production during D-xylose fermentation by Candida shehatae. Can. J	Palnitkar, S.,Lachke, A.	Microbiol.	1992	258-260	38	1393828
15	Evidence that the gene YLR070c of Saccharomyces cerevisiae encodes a xylitol dehydrogenase	Richard, P.,Toivari, M.H.,Penttilae, M.	FEBS Lett.	1999	135-138	457	10486580
16	Changing flux of xylose metabolites by altering expression of xylose reductase and xylitol dehydrogenase in recombinant Saccharomyces cerevisiae. Appl. Biochem	Jin, Y.S.,Jeffries, T.W.	Biotechnol.	2003	277-286	105 -108	12721451
17	Xylose reductase and xylitol dehydrogenase activities of Candida guilliermondii as a function of different treatments of sugarcane bagasse hemicellulosic hydrolysate employing experimental design. Appl. Biochem	Alves, L.A.,Vitolo, M.,Felipe, M.G.,de Almeida e Silva, J.B.	Biotechnol.	2002	403-413	98-100	12018268
18	Utilization of xylitol dehydrogenase in a combined microbial/enzymatic process for production of xylitol from D-glucose. Appl. Biochem	Mayer, G.,Kulbe, K.D.,Nidetzky, B.	Biotechnol.	2002	577-589	98-100	12018283
19	Effect of acetic acid present in bagasse hydrolysate on the activities of xylose reductase and xylitol dehydrogenase in Candida guilliermondii. Appl. Microbiol	Lima, L.H.,das Gracas de Almeida Felipe, M.,Vitolo, M.,Torres, F.A.	Biotechnol.	2004	734-738	65	15107950
20	Cloning of the xylitol dehydrogenase gene from Gluconobacter oxydans and improved production of xylitol from D-arabitol. Biosci. Biotechnol	Sugiyama, M.,Suzuki, S.,Tonouchi, N.,Yokozeki, K.	Biochem.	2003	584-591	67	12723607
21	Purification and characterization of NAD+-dependent xylitol dehydrogenase from Fusarium oxysporum. Biotechnol	Panagiotou, G.,Kekos, D.,Macris, B.J.,Christakopoulos, P.	Lett.	2002	2089-2092	24	-----
22	Characterization of recombinant xylitol dehydrogenase from Galactocandida mastotermitis expressed in Escherichia coli. Chem. Biol	Nidetzky, B.,Helmer, H.,Klimacek, M.,Lunzer, R.,Mayer, G.	Interact.	2003	533-542	143-144	12604239
23	Influence of pH on the xylose reductase activity of Candida guilliermondii during fed-batch xylitol bioproduction. J	Godoy de Andrade Rodrigues, D.C.,Silverio da Silva, S.,Vitolo, M.	Basic Microbiol.	2002	201-206	42	12111747
24	Cloning and expression of a NAD+-dependent xylitol dehydrogenase gene (xdhA) of Aspergillus oryzae. J. Biosci	Tran, L.H.,Kitamoto, N.,Kawai, K.,Takamizawa, K.,Suzuki, T.	Bioeng.	2004	419-422	97	16233653
25	Optimized extraction by cetyl trimethyl ammonium bromide reversed micelles of xylose reductase and xylitol dehydrogenase from Candida guilliermondii homogenate. J. Chromatogr	Cortez, E.V.,Pessoa, A.Jr.,das Gracas de Almeida Felipe, M.,Roberto, I.C.,Vitolo, M.	B	2004	47-54	807	15177159
26	The activity of xylose reductase and xylitol dehydrogenase in yeasts	Yablochkova, E.N.,Bolotnikova, O.I.,Mikhailova, N.P.,Nemova, N.N.,Ginak, A.I.	Microbiology	2003	414-417	72	14526534
27	Investigation of limiting metabolic steps in the utilization of xylose by recombinant Saccharomyces cerevisiae using metabolic engineering	Karhumaa, K.,Hahn-Haegerdal, B.,Gorwa-Grauslund, M.F.	Yeast	2005	359-368	22	15806613
28	Characterization of the AXDH gene and the encoded xylitol dehydrogenase from the dimorphic yeast Arxula adeninivorans	Böer, E.,Wartmann, T.,Schmidt, S.,Bode, R.,Gellissen, G.,Kunze, G.	Antonie van Leeuwenhoek	2005	233-243	87	15803389
29	Production of xylitol from D-xylose by a xylitol dehydrogenase gene-disrupted mutant of Candida tropicalis. Appl. Environ	Ko, B.S.,Kim, J.,Kim, J.H.	Microbiol.	2006	4207-4213	72	16751533
30	Response surface methodology as an approach to determine the optimal activities of xylose reductase and xylitol dehydrogenase enzymes from Candida mogii. Appl. Microbiol	Mayerhoff, Z.D.,Roberto, I.C.,Franco, T.T.	Biotechnol.	2006	761-767	70	16505992
31	Enhanced xylitol production by precultivation of Candida guilliermondii cells in sugarcane bagasse hemicellulosic hydrolysate. Curr	Rodrigues, R.C.,Sene, L.,Matos, G.S.,Roberto, I.C.,Pessoa, A.,Felipe, M.G.	Microbiol.	2006	53-59	53	16775788
32	Complete reversal of coenzyme specificity of xylitol dehydrogenase and increase of thermostability by the introduction of structural zinc. J. Biol	Watanabe, S.,Kodaki, T.,Makino, K.	Chem.	2005	10340-10349	280	15623532
33	Effect of glucose:xylose ratio on xylose reductase and xylitol dehydrogenase activities from Candida guilliermondii in sugarcane bagasse hydrolysate. J. Chem. Technol	Virginio da Silva, D.D.,Felipe, M.	Biotechnol.	2006	1294-1300	81	-----
34	Structure-guided engineering of xylitol dehydrogenase cosubstrate specificity	Ehrensberger, A.H.,Elling, R.A.,Wilson, D.K.	Structure	2006	567-575	14	16531240
35	Overexpression of bacterial xylose isomerase and yeast host xylulokinase improves xylose alcoholic fermentation in the thermotolerant yeast Hansenula polymorpha	Dmytruk, O.V.,Voronovsky, A.Y.,Abbas, C.A.,Dmytruk, K.V.,Ishchuk, O.P.,Sibirny, A.A.	FEMS Yeast Res.	2008	165-173	8	17662053
36	Metabolic engineering of Saccharomyces cerevisiae for conversion of D-glucose to xylitol and other five-carbon sugars and sugar alcohols. Appl. Environ	Toivari, M.H.,Ruohonen, L.,Miasnikov, A.N.,Richard, P.,Penttila, M.	Microbiol.	2007	5471-5476	73	17630301
37	High activity of xylose reductase and xylitol dehydrogenase improves xylose fermentation by recombinant Saccharomyces cerevisiae. Appl. Microbiol	Karhumaa, K.,Fromanger, R.,Hahn-Haegerdal, B.,Gorwa-Grauslund, M.	Biotechnol.	2007	1039-1046	73	16977466
38	A rare sugar xylitol. Part I: The biochemistry and biosynthesis of xylitol. Appl. Microbiol	Granstroem, T.B.,Izumori, K.,Leisola, M.	Biotechnol.	2007	277-281	74	17216457
39	Catalytic mechanism of Zn2+-dependent polyol dehydrogenases: kinetic comparison of sheep liver sorbitol dehydrogenase with wild-type and Glu154-Cys forms of yeast xylitol dehydrogenase. Biochem	Klimacek, M.,Hellmer, H.,Nidetzky, B.	J.	2007	421-429	404	17343568
40	Production of L-xylulose from xylitol by a newly isolated strain of Bacillus pallidus Y25 and characterization of its relevant enzyme xylitol dehydrogenase. Enzyme Microb	Poonperm, W.,Takata, G.,Morimoto, K.,Granstroem, T.B.,Izumori, K.	Technol.	2007	1206-1212	40	-----
41	Thermostabilization of Pichia stipitis xylitol dehydrogenase by mutation of structural zinc-binding loop. J	Annaluru, N.,Watanabe, S.,Pack, S.P.,Saleh, A.A.,Kodaki, T.,Makino, K.	Biotechnol.	2007	717-722	129	17350704
42	Effect of the reversal of coenzyme specificity by expression of mutated Pichia stipitis xylitol dehydrogenase in recombinant Saccharomyces cerevisiae. Lett. Appl	Hou, J.,Shen, Y.,Li, X.P.,Bao, X.M.	Microbiol.	2007	184-189	45	17651216
43	Engineering of a matched pair of xylose reductase and xylitol dehydrogenase for xylose fermentation by Saccharomyces cerevisiae. Biotechnol	Krahulec, S.,Klimacek, M.,Nidetzky, B.	J.	2009	684-694	4	19452479
44	Profiles of xylose reductase, xylitol dehydrogenase and xylitol production under different oxygen transfer volumetric coefficient values. J. Chem. Technol	Branco, R.,dos Santos, J.,Sarrouh, B.,Rivaldi, J.,Pessoa Jr., A.,da Silva, S.	Biotechnol.	2009	326-330	84	-----
45	The behavior of key enzymes of xylose metabolism on the xylitol production by Candida guilliermondii grown in hemicellulosic hydrolysate. J. Ind. Microbiol	Gurpilhares, D.B.,Hasmann, F.A.,Pessoa, A.,Roberto, I.C.	Biotechnol.	2009	87-93	36	18830730
46	Altering the coenzyme preference of xylose reductase to favor utilization of NADH enhances ethanol yield from xylose in a metabolically engineered strain of Saccharomyces cerevisiae. Microb	Petschacher, B.,Nidetzky, B.	Cell Fact.	2008	9	7	18346277
47	Cloning and characterization of a thermostable xylitol dehydrogenase from Rhizobium etli CFN42. Appl. Microbiol	Tiwari, M.K.,Moon, H.J.,Jeya, M.,Lee, J.K.	Biotechnol.	2010	571-581	87	20177886
48	NAD+-dependent xylitol dehydrogenase (xdhA) and L-arabitol-4-dehydrogenase (ladA) deletion mutants of Aspergillus oryzae for improved xylitol production. Biotechnol	Mahmud, A.,Hattori, K.,Hongwen, C.,Kitamoto, N.,Suzuki, T.,Nakamura, K.,Takamizawa, K.	Lett.	2013	769-777	35	23436125
49	Feasibility of xylose fermentation by engineered Saccharomyces cerevisiae overexpressing endogenous aldose reductase (GRE3), xylitol dehydrogenase (XYL2) and xylulokinase (XYL3) from Scheffersomyces stipitis	Kim, S.R.,Kwee, N.R.,Kim, H.,Jin, Y.S.	FEMS Yeast Res.	2013	312-321	13	23398717
50	Purification of xylitol dehydrogenase and improved production of xylitol by increasing XDH activity and NADH supply in Gluconobacter oxydans. J. Agric	Zhang, J.,Li, S.,Xu, H.,Zhou, P.,Zhang, L.,Ouyang, P.	Food Chem.	2013	2861-2867	61	-----
51	Analysis and prediction of the physiological effects of altered coenzyme specificity in xylose reductase and xylitol dehydrogenase during xylose fermentation by Saccharomyces cerevisiae. J	Krahulec, S.,Klimacek, M.,Nidetzky, B.	Biotechnol.	2012	192-202	158	21903144
52	Molecular analysis of NAD+-dependent xylitol dehydrogenase from the zygomycetous fungus Rhizomucor pusillus and reversal of the coenzyme preference. Biosci. Biotechnol	Yamasaki-Yashiki, S.,Komeda, H.,Hoshino, K.,Asano, Y.	Biochem.	2014	1943-1953	78	25082263
53	Effects of xylitol dehydrogenase (XYL2) on xylose fermentation by engineered Candida glycerinogenes. Biotechnol. Appl	Zong, H.,Zhang, C.,Zhuge, B.,Lu, X.,Fang, H.,Sun, J.	Biochem.	2017	590-599	64	27245615
54	Enhanced xylitol production: Expression of xylitol dehydrogenase from Gluconobacter oxydans and mixed culture of resting cell. J. Biosci	Qi, X.H.,Zhu, J.F.,Yun, J.H.,Lin, J.,Qi, Y.L.,Guo, Q.,Xu, H.	Bioeng.	2016	257-262	122	26975753
55	Purification and characterization of xylitol dehydrogenase with L-arabitol dehydrogenase activity from the newly isolated pentose-fermenting yeast Meyerozyma caribbica 5XY2. J. Biosci	Sukpipat, W.,Komeda, H.,Prasertsan, P.,Asano, Y.	Bioeng.	2016	20-27	123	27506274
56	Point mutation of the xylose reductase (XR) gene reduces xylitol accumulation and increases citric acid production in Aspergillus carbonarius. J. Ind. Microbiol	Weyda, I.,Luebeck, M.,Ahring, B.K.,Luebeck, P.S.	Biotechnol.	2014	733-739	41	24570325
57	Integrative expression vectors for overexpression of xylitol dehydrogenase (XYL2) in osmotolerant yeast, Candida glycerinogenes WL2002-5. J. Ind. Microbiol	Zhang, C.,Zong, H.,Zhuge, B.,Lu, X.,Fang, H.,Zhuge, J.	Biotechnol.	2015	113-124	42	25363139
58	Xylitol production by NAD+-dependent xylitol dehydrogenase (xdhA)- and L-arabitol-4-dehydrogenase (ladA)-disrupted mutants of Aspergillus oryzae. J. Biosci	Mahmud, A.,Hattori, K.,Hongwen, C.,Kitamoto, N.,Suzuki, T.,Nakamura, K.,Takamizawa, K.	Bioeng.	2013	353-359	115	23287496
59	Boost in bioethanol production using recombinant Saccharomyces cerevisiae with mutated strictly NADPH-dependent xylose reductase and NADP+-dependent xylitol dehydrogenase. J	Khattab, S.M.,Saimura, M.,Kodaki, T.	Biotechnol.	2013	153-156	165	23578809
60	Molecular analysis of NAD+-dependent xylitol dehydrogenase from the zygomycetous fungus Rhizomucor pusillus and reversal of the coenzyme preference. Biosci. Biotechnol	Yamasaki-Yashiki, S.,Komeda, H.,Hoshino, K.,Asano, Y.	Biochem.	2014	1943-1953	78	25082263
61	Purification of xylitol dehydrogenase and improved production of xylitol by increasing XDH activity and NADH supply in Gluconobacter oxydans. J. Agric	Zhang, J.,Li, S.,Xu, H.,Zhou, P.,Zhang, L.,Ouyang, P.	Food Chem.	2013	2861-2867	61	23432201
62	Xylitol production by NAD+-dependent xylitol dehydrogenase (xdhA)- and L-arabitol-4-dehydrogenase (ladA)-disrupted mutants of Aspergillus oryzae. J. Biosci	Mahmud, A.,Hattori, K.,Hongwen, C.,Kitamoto, N.,Suzuki, T.,Nakamura, K.,Takamizawa, K.	Bioeng.	2013	353-359	115	23287496
63	Enhanced xylitol production	 expression of xylitol dehydrogenase from Gluconobacter oxydans and mixed culture of resting cell. J. Biosci	Qi, X.H.,Zhu, J.F.,Yun, J.H.,Lin, J.,Qi, Y.L.,Guo, Q.,Xu, H.	Bioeng.	2016	257-262	122	26975753
64	Analysis of metabolisms and transports of xylitol using xylose- and xylitol-assimilating Saccharomyces cerevisiae. J. Biosci	Tani, T.,Taguchi, H.,Akamatsu, T.	Bioeng.	2017	613-620	123	28126230
65	Point mutation of the xylose reductase (XR) gene reduces xylitol accumulation and increases citric acid production in Aspergillus carbonarius. J. Ind. Microbiol	Weyda, I.,Luebeck, M.,Ahring, B.K.,Luebeck, P.S.	Biotechnol.	2014	733-739	41	24570325
66	Enhanced xylose fermentation by engineered yeast expressing NADH oxidase through high cell density inoculums. J. Ind. Microbiol	Zhang, G.C.,Turner, T.L.,Jin, Y.S.	Biotechnol.	2017	387-395	44	28070721
67	Identification of NAD-dependent xylitol dehydrogenase from Gluconobacter oxydans WSH-003	Liu, L.,Zeng, W.,Du, G.,Chen, J.,Zhou, J.	ACS omega	2019	15074-15080	4	31552350
68	Construction of efficient xylose-fermenting Saccharomyces cerevisiae through a synthetic isozyme system of xylose reductase from Scheffersomyces stipitis. Biores	Jo, J.H.,Park, Y.C.,Jin, Y.S.,Seo, J.H.	Technol.	2017	88-94	241	28550778
69	Xylose fermentation efficiency of industrial Saccharomyces cerevisiae yeast with separate or combined xylose reductase/xylitol dehydrogenase and xylose isomerase pathways. Biotechnol	Cunha, J.T.,Soares, P.O.,Romani, A.,Thevelein, J.M.,Domingues, L.	Biofuels	2019	20	12	30705706
70	Photosynthetic reduction of xylose to xylitol using cyanobacteria. Biotechnol	Fan, E.S.,Lu, K.W.,Wen, R.C.,Shen, C.R.	J.	2020	e1900354	15	32388928
71	Combining xylose reductase from Spathaspora arborariae with xylitol dehydrogenase from Spathaspora passalidarum to promote xylose consumption and fermentation into xylitol by Saccharomyces cerevisiae	Mouro, A.,Santos, A.,Agnolo, D.,Gubert, G.,Bon, E.,Rosa, C.,Fonseca, C.,Stambuk, B.	Fermentation	2020	72	6	-----
72	Purification and characterization of xylitol dehydrogenase with L-arabitol dehydrogenase activity from the newly isolated pentose-fermenting yeast Meyerozyma caribbica 5XY2. J. Biosci	Sukpipat, W.,Komeda, H.,Prasertsan, P.,Asano, Y.	Bioeng.	2017	20-27	123	27506274
73	Cloning and functional characterization of xylitol dehydrogenase genes from Issatchenkia orientalis and Torulaspora delbrueckii. J. Biosci	Han, X.,Hu, X.,Zhou, C.,Wang, H.,Li, Q.,Ouyang, Y.,Kuang, X.,Xiao, D.,Xiang, Q.,Yu, X.,Li, X.,Gu, Y.,Zhao, K.,Chen, Q.,Ma, M.	Bioeng.	2020	29-35	130	32171656
74	Heterologous expression of Spathaspora passalidarum xylose reductase and xylitol dehydrogenase genes improved xylose fermentation ability of Aureobasidium pullulans. Microb	Guo, J.,Huang, S.,Chen, Y.,Guo, X.,Xiao, D.	Cell Fact.	2018	64	17	29712559
